S No.,summary,text,Prompt 1,Prompt 2,Prompt 3
1,কাৰাবন্দীৰ পৰা গৃহবন্দী হৈ উভতিল আং ছান ছু কী,আং ছান ছু কীফাইল ফটোসংগ্ৰহীতকাৰাগাৰৰ সূত্ৰই জনোৱা মতে সোমবাৰে কাৰাগাৰৰ পৰা ৰাজধানী নেইপিড চৰকাৰী বাসগৃহলৈ স্থানান্তৰ কৰা হয় ছ্যু কীকলগতে পঢ়কআই এন এছ বিক্ৰান্তত যুৱ নৌসেনা জোৱানৰ মৃতদেহ উদ্ধাৰ ৰহস্যময় মৃত্যুক লৈ চাঞ্চল্য কাৰাগাৰৰ পৰা বদলি হোৱাৰ কথা আনুষ্ঠানিকভাৱে নিশ্চিত কৰা হোৱা নাইঅৱশ্যে গৃহবন্দী কৰাৰ বিষয়টো সামৰিক কৰ্তৃপক্ষৰ এক ইতিবাচক পদক্ষেপো হব পাৰেছ্যু কীক অসুস্থ বুলি বাতৰি প্ৰচাৰ হৈছিলঅৱশ্যে সেনাই এই কথা অস্বীকাৰ কৰিছেচলিত সপ্তাহৰ আৰম্ভণিতে কাৰাগাৰৰ সূত্ৰই প্ৰকাশ কৰা অনুসৰি ছু কীৰ স্বাস্থ্য ভালেই আছেলগতে পঢ়কমাজভাগতে শিক্ষা এৰিছে কেন্দ্ৰীয় বিশ্ববিদ্যালয়ৰ ২৫ হাজাৰ ৫৯৩ জন ছাত্ৰছাত্ৰীয়ে থাইলেণ্ডৰ বৈদেশিক মন্ত্ৰীয়ে চলিত মাহত কাৰাগাৰত থকা ছু কীৰ ওচৰলৈ গৈছিলঅৱশ্যে তেওঁ আৰু কোনো সবিশেষ তথ্য প্ৰকাশ কৰা নাই নৰ্থইষ্ট নাও এটা মাল্টিএপ ভিত্তিক সম্পূৰ্ণভাৱে আঞ্চলিক দ্বিভাষিক নিউজ প্টেলপেচাদাৰী ব্যক্তিৰ এটা গোটৰ নেতৃত্বত এই ডিজিটেল অসমীয়া বাতৰি প্ৰতিষ্ঠানটোৱে উত্তৰপূবৰ আঠখন ৰাজ্য আৰু এইবোৰৰ প্ৰতিৱেশী দেশকেইখনৰ প্ৰতিটো খাখবৰ সামৰি লোৱাৰ চেষ্টা কৰিবদুটাকৈ ইংৰাজী এপ আৰু এটা অসমীয়া এপৰ সংস্কৰণ থকা এইটোৱে হল এই ধৰণৰ প্ৰথমটো নিউজ প্টেলআমি ৰাজনৈতিকভাৱে নিৰপেক্ষ আৰু দক্ষিণপূব আৰু দক্ষিণ এছিয়াৰ মাজৰ প্ৰকৃত বাবাতৰিৰ সাঁকোৰ ভূমিকা লবলৈ চেষ্টা কৰিম,অসমীয়া ছু কীক কাৰাগাৰৰ পৰা স্থানান্তৰ কৰা হয় কিন্তু তেওঁৰ মৃত্যুৰ কথা অস্বীকাৰ কৰা হৈছে।,অসমৰ হাবিৰ বননিয়ে পোৱা ঢেঁকীয়া শাকমুঠিৰ উপকাৰিতা কিমান জানেনে ঢেঁকীয়া শাকমুঠিৰ উপকাৰিতা হল প্ৰতি ১০০ গ্ৰাম ঢেঁকীয়া ভেষজত ৩৪ কেলোৰি থাকে যি এক কাৰ্যকৰী প্ৰাকৃতিক পানী দ্ৰৱনীয় যিয়ে শৰীৰত সংক্ৰামক এজেণ্টৰ বিৰুদ্ধে প্ৰতিৰোধ ক্ষমতা বিকশিত কৰে আৰু শৰীৰত কৰ্কট ৰোগমুক্ত ৰেডিকেল আঁতৰ কৰে। এই শাকমুঠিৰ উপকাৰিতা হল প্ৰতি ১০০ গ্ৰাম ঢেঁকীয়া ভেষজত ৪৪ শতাংশ ভিটামিন থাকে যি এক কাৰ্যকৰী প্ৰাকৃতিক পানী দ্ৰৱনীয় যিয়ে শৰীৰত সংক্ৰামক এজেণ্টৰ বিৰুদ্ধে প্ৰতিৰোধ ক্ষমতা বিকশিত কৰে আৰু শৰীৰত কৰ্কট ৰোগমুক্ত ৰেডিকেল আঁতৰ কৰে।,ছ্যু কী                                          ছ্যু কী                                                            ছ্যু কী                                                        ছ্যু কী                                                           ছ্যু কী                                           ছ্যু কী                                    ছ্যু কীক কাৰাগাৰৰ পৰা স্থানান্তৰ কৰা হয় যদিও নৌসেনা জোৱানৰ মৃতদেহ উদ্ধাৰ হোৱাৰ কাৰণ অজ্ঞাত আছে। এই ঘটনাটোৱে সামৰিক কৰ্তৃপক্ষৰ সকলো সংস্কৃতিৰ সমালোচনা কৰিছে।
2,চীন কোৰিয়া ইণ্ডোনেছিয়াৰ পৰা আমদানি কৰা অপটিকেল ফাইবাৰৰ ওপৰত আৰোপ এণ্টি ডাম্পিং শুল্ক,ফটোসংগ্ৰহীতসস্তীয়া আমদানিৰ পৰা ঘৰুৱা উদ্যোগক সুৰক্ষিত কৰিবলৈ এই পৰামৰ্শ দিয়া হৈছেডাম্পিংৰ অভিযোগৰ পিছত কৰ্তৃপক্ষই তদন্ত কৰি ফলাফলৰ ভিত্তিত এই পৰামৰ্শ দিছেএই দেশসমূহৰ পৰা আমদানি কৰা ডিচপাৰচন আনশ্বিফ্টেড চিংগলমড অপটিকেল ফাইবাৰ ডাম্পিং পৰীক্ষা কৰি এই পৰামৰ্শ আগবঢ়াইছে ডিজিটিআৰেবিৰলা ফুৰুকাৱা ফাইবাৰ অপটিক্স প্ৰাইভেট লিমিটেডে ঘৰুৱা উদ্যোগৰ ফালৰ পৰা এই সামগ্ৰীৰ ওপৰত এণ্টি ডাম্পিং তদন্ত আৰম্ভ কৰিবলৈ কৈছিলডিজিটিআৰে নিজৰ তদন্তত বিচাৰি পাইছে যে আমদানিৰ বাবে ঘৰুৱা উদ্যোগটোৱে লোকচানৰ সন্মুখীন হৈছেডিজিটিআৰে ইয়াৰ তথ্যত বিচাৰি পাইছে যে ডাম্প কৰা আমদানিৰ বাবে ঘৰুৱা উদ্যোগটোৱে সামগ্ৰীৰ লোকচানৰ সন্মুখীন হৈছেডিজিটিআৰে এক অধিসূচনাযোগে জনাইছে যে ভাৰতীয় বজাৰত মজুত আমদানিৰ অস্তিত্বৰ বাবে আবেদনকাৰীয়ে বিক্ৰীৰ খৰচতকৈ কম মূল্যত সামগ্ৰী বিক্ৰী কৰিবলৈ বাধ্য হৈছেইয়াৰ ফলত লোকচান হৈছে আৰু ঘৰুৱা উদ্যোগৰ লাভজনক মানদণ্ডত বিৰূপ প্ৰভাৱ পৰিছেসেয়েহে ঘৰুৱা উদ্যোগটোক ক্ষতিৰ পৰা ৰক্ষা কৰিবলৈ এণ্টি ডাম্পিং শুল্ক আৰোপ কৰাৰ পৰামৰ্শ আগবঢ়াইছে কৰ্তৃপক্ষই নৰ্থইষ্ট নাও এটা মাল্টিএপ ভিত্তিক সম্পূৰ্ণভাৱে আঞ্চলিক দ্বিভাষিক নিউজ প্টেলপেচাদাৰী ব্যক্তিৰ এটা গোটৰ নেতৃত্বত এই ডিজিটেল অসমীয়া বাতৰি প্ৰতিষ্ঠানটোৱে উত্তৰপূবৰ আঠখন ৰাজ্য আৰু এইবোৰৰ প্ৰতিৱেশী দেশকেইখনৰ প্ৰতিটো খাখবৰ সামৰি লোৱাৰ চেষ্টা কৰিবদুটাকৈ ইংৰাজী এপ আৰু এটা অসমীয়া এপৰ সংস্কৰণ থকা এইটোৱে হল এই ধৰণৰ প্ৰথমটো নিউজ প্টেলআমি ৰাজনৈতিকভাৱে নিৰপেক্ষ আৰু দক্ষিণপূব আৰু দক্ষিণ এছিয়াৰ মাজৰ প্ৰকৃত বাবাতৰিৰ সাঁকোৰ ভূমিকা লবলৈ চেষ্টা কৰিম,ফটোসংগ্ৰহীতসস্তীয়া আমদানিৰ পৰা ঘৰুৱা উদ্যোগক সুৰক্ষিত কৰিবলৈ এণ্টি ডাম্পিং শুল্ক আৰোপ কৰাৰ পৰামৰ্শ দিয়া হৈছে।,অসমৰ হাবিৰ পৰা পোৱা ঢেঁকীয়া শাকমুঠিৰ উপকাৰিতা কিমান জানেনে এই শাকটো হাবিৰ পৰা পোৱা হয় আৰু এই শাকটো অসমৰ হাবিৰ পৰা পোৱা হয় আৰু এই শাকটো অসমৰ হাবিৰ পৰা পোৱা হয় আৰু এই শাকটো অসমৰ হাবিৰ পৰা পোৱা হয় আৰু এই শাকটো অসমৰ হাবিৰ পৰা পোৱা হয় আৰু এই শাকটো অসমৰ হাবিৰ পৰা পোৱা হয় আৰু এই শাকটো অসমৰ হাবিৰ পৰা পোৱা হয় আৰু এই শাকটো অসমৰ হাবিৰ পৰা পোৱা হয় আৰু এই শাকটো অসমৰ হাবিৰ পৰা পোৱা হয় আৰু এই শাকটো অসমৰ হাবিৰ পৰা পোৱা হয় আৰু এই শাকটো অসমৰ হাবিৰ পৰা পোৱা হয় আৰু এই শাকটো অসমৰ হাবিৰ পৰা পোৱা হয় আৰু এই শাকটো অসমৰ হাবিৰ পৰা পোৱা হয় আৰু এই শাকটো অসমৰ হাবিৰ পৰা পোৱা হয় আৰু এই শাকটো অসমৰ হাবিৰ পৰা পোৱা হয় আৰু এই শাকটো অসমৰ হাবিৰ পৰা পোৱা হয় আৰু এই শাকটো অসমৰ হাবিৰ পৰা পোৱা হয় আৰু এই শাকটো অসমৰ হাবিৰ পৰা পোৱা হয় আৰু এই শাকটো অসমৰ হাবিৰ পৰা পোৱা হয় আৰু এই শাকটো অসমৰ হাবিৰ পৰা পোৱা হয় আৰু এই শাকটো অসমৰ হাবিৰ পৰা পোৱা হয় আৰু এই শাকটো অসমৰ হাবিৰ পৰা পোৱা হয় আৰু এই শাকটো অসমৰ হাবিৰ পৰা পোৱা হয় আৰু এই শাকটো অসমৰ হাবিৰ পৰা পোৱা হয় আৰু এই শাকটো অসমৰ হাবিৰ পৰা পোৱা হয় আৰু এই শাকটো অসমৰ হাবিৰ পৰা পোৱা হয় আৰু এই শাকটো অসমৰ হাবিৰ পৰা পোৱা হয় আৰু এই শাকটো অসমৰ হাবিৰ পৰা পোৱা হয় আৰু এই শাকটো অসমৰ হাবিৰ পৰা পোৱা হয় আৰু এই শাকটো অসমৰ হাবিৰ পৰা পোৱা হয় আৰু এই শাকটো অসমৰ হাবিৰ পৰা পোৱা হয় আৰু এই শাকটো অসমৰ হাবিৰ পৰা পোৱা হয় আৰু এই শাকটো অসমৰ হাবিৰ পৰা পোৱা হয় আৰু এই শাকটো অসমৰ হাবিৰ পৰা পোৱা হয় আৰু এই শাকটো অসমৰ হাবিৰ পৰা পোৱা হয় আৰু এই শাকটো অসমৰ হাবিৰ পৰা পোৱা হয় আৰু এই শাকটো অসমৰ হাবিৰ পৰা পোৱা হয় আৰু এই শাকটো অসমৰ হাবিৰ পৰা পোৱা হয় আৰু এই শাকটো অসমৰ হাবিৰ পৰা পোৱা হয় আৰু এই শাকটো অসমৰ হাবিৰ পৰা পোৱা হয় আৰু এই শাকটো অসমৰ হাবিৰ পৰা পোৱা হয় আৰু এই শাকটো অসমৰ হাবিৰ পৰা পোৱা হয় আৰু এই শাকটো অসমৰ হাবিৰ পৰা পোৱা হয়,ফটোসংগ্ৰহীতসস্তীয়া আমদানিৰ পৰা ঘৰুৱা উদ্যোগক সুৰক্ষিত কৰিবলৈ এই পৰামৰ্শ দিয়া হৈছে। এই পৰামৰ্শ ঘৰুৱা উদ্যোগটোক ক্ষতিৰ পৰা ৰক্ষা কৰিবলৈ আৰু অসমীয়া অৰ্থনীতিৰ উন্নয়ন ঘটাবলৈ সহায় কৰিব।
3,গ্ৰেপ্তাৰ হল ইমৰান খানদুৰ্নীতিৰ গোচৰত তিনিবছৰৰ বাবে কাৰাগাৰলৈ নিক্ষেপ,বিপদে লগ নেৰা হৈছে পাকিস্তানৰ প্ৰাক্তন প্ৰধানমন্ত্ৰী ইমৰান খানকপাকিস্তানৰ এক আদালতে দুৰ্নীতিৰ গোচৰত প্ৰাক্তন প্ৰধানমন্ত্ৰীগৰাকীক তিনি বছৰৰ কাৰাদণ্ডৰ শাস্তি প্ৰদান কৰাৰ পিছতে আজি গ্ৰেপ্তাৰ কৰা হয়ইছলামাবাদৰ বিচাৰ আদালতে খানক পাঁচ বছৰৰ বাবে সক্ৰিয় ৰাজনীতিত অংশগ্ৰহণ কৰাতো বাধা আৰোপ কৰাৰ লগতে ১ লাখ টকাৰ জৰিমনাও আৰোপ কৰিছেএই জৰিমনা পৰিশোধ নকৰিলে তেওঁ অতিৰিক্ত ৬ মাহ কাৰাবাস খাটিব লাগিবখানৰ বিৰুদ্ধে তেওঁৰ প্ৰধানমন্ত্ৰী কাৰ্যকালত বিদেশৰ ব্যক্তিৰ পৰা লাভ কৰা উপহাৰ অবৈধভাৱে বিক্ৰী কৰাৰ অভিযোগ উত্থাপন হৈছিল আৰু আদালতে এই গোচৰত তেওঁক দোষী সাব্যস্ত কৰেআদালতৰ এই ৰায়ৰ পিছতো অৱশ্যে ইমৰান খানে অভিযোগ অস্বীকাৰ কৰিছেইমৰান খানৰ ৰাজনৈতিক দল তেহৰিকঈইনচাফে এই ৰায়ৰ বিৰুদ্ধে খান শীঘ্ৰেই পাকিস্তানৰ উচ্চতম ন্যায়ালয়ৰ কাষ চাপিব বুলি সদৰী কৰিছেলক্ষণীয়ভাৱে যোৱা মে মাহতো দুৰ্নীতিৰ অভিযোগত খানক গ্ৰেপ্তাৰ কৰাৰ পিছতে দেশখনত হিংসাত্মক প্ৰতিবাদৰ সৃষ্টি হৈছিলখানৰ সমৰ্থকসকলে তেওঁৰ সমৰ্থনত তীব্ৰ প্ৰতিবাদ গঢ়ি তুলিছিলউল্লেখ্য যে বিগত বৰ্ষত অনাস্থা প্ৰস্তাৱৰ সন্মুখীন হৈ প্ৰধানমন্ত্ৰী পদৰ পৰা ক্ষমতাচ্যুত হবলগা হৈছিল ইমৰান খানআনহাতে খানে তেওঁৰ বিৰুদ্ধে এয়া ষড়যন্ত্ৰ বুলি অভিহিত কৰি দেশৰ সেনাবাহিনী এই ষড়যন্ত্ৰত জড়িত বুলি অভিযোগ কৰিছিলঅৱশ্যে খানে উত্থাপন কৰা অভিযোগ অস্বীকাৰ কৰি সেনাই এই বিষয়ত কোনো ভূমিকা লোৱা নাই বুলি স্পষ্ট কৰি দিছিল নৰ্থইষ্ট নাও এটা মাল্টিএপ ভিত্তিক সম্পূৰ্ণভাৱে আঞ্চলিক দ্বিভাষিক নিউজ প্টেলপেচাদাৰী ব্যক্তিৰ এটা গোটৰ নেতৃত্বত এই ডিজিটেল অসমীয়া বাতৰি প্ৰতিষ্ঠানটোৱে উত্তৰপূবৰ আঠখন ৰাজ্য আৰু এইবোৰৰ প্ৰতিৱেশী দেশকেইখনৰ প্ৰতিটো খাখবৰ সামৰি লোৱাৰ চেষ্টা কৰিবদুটাকৈ ইংৰাজী এপ আৰু এটা অসমীয়া এপৰ সংস্কৰণ থকা এইটোৱে হল এই ধৰণৰ প্ৰথমটো নিউজ প্টেলআমি ৰাজনৈতিকভাৱে নিৰপেক্ষ আৰু দক্ষিণপূব আৰু দক্ষিণ এছিয়াৰ মাজৰ প্ৰকৃত বাবাতৰিৰ সাঁকোৰ ভূমিকা লবলৈ চেষ্টা কৰিম,পাকিস্তানৰ প্ৰাক্তন প্ৰধানমন্ত্ৰী ইমৰান খানক দুৰ্নীতিৰ অভিযোগত তিনি বছৰৰ কাৰাদণ্ডৰ শাস্তি প্ৰদান কৰা হৈছে।,অসমৰ হাবিৰ বননিয়ে পোৱা ঢেঁকীয়া শাকমুঠিৰ উপকাৰিতা কিমান জানেনে ঢেঁকীয়া শাকমুঠিৰ উপকাৰিতা হল প্ৰধানমন্ত্ৰী ইমৰান খানক দুৰ্নীতিৰ গোচৰত প্ৰাক্তন প্ৰধানমন্ত্ৰীগৰাকীক তিনি বছৰৰ কাৰাদণ্ডৰ শাস্তি প্ৰদান কৰাৰ পিছতে আজি গ্ৰেপ্তাৰ কৰা হয়ইছলামাবাদৰ বিচাৰ আদালতে খানক পাঁচ বছৰৰ বাবে সক্ৰিয় ৰাজনীতিত অংশগ্ৰহণ কৰাতো বাধা আৰোপ কৰাৰ লগতে ১ লাখ টকাৰ জৰিমনাও আৰোপ কৰিছেএই জৰিমনা পৰিশোধ নকৰিলে তেওঁ অতিৰিক্ত ৬ মাহ কাৰাবাস খাটিব লাগিবখানৰ বিৰুদ্ধে তেওঁৰ প্ৰধানমন্ত্ৰী কাৰ্যকালত বিদেশৰ ব্যক্তিৰ পৰা লাভ কৰা উপহাৰ অবৈধভাৱে বিক্ৰী কৰাৰ অভিযোগ উত্থাপন হৈছিল আৰু আদালতে এই গোচৰত তেওঁক দোষী সাব্যস্ত কৰেআদালতৰ এই ৰায়ৰ পিছতো অৱশ্যে ইমৰান খানে অভিযোগ অস্বীকাৰ কৰিছেইমৰান খানৰ ৰাজনৈতিক দল তেহৰিকঈইনচাফে এই ৰায়ৰ বিৰুদ্ধে খান শীঘ্ৰেই পাকিস্তানৰ উচ্চতম ন্যায়ালয়ৰ কাষ চাপিব বুলি সদৰী কৰিছেলক্ষণীয়ভাৱে যোৱা মে মাহতো দুৰ্নীতিৰ অভিযোগত খানক গ্ৰেপ্তাৰ কৰাৰ পিছতে দেশখনত হিংসাত্মক প্ৰতিবাদৰ সৃষ্টি হৈছিলখানৰ সমৰ্থকসকলে তেওঁৰ সমৰ্থনত তীব্ৰ প্ৰতিবাদ গঢ়ি তুলিছিলউল্লেখ্য যে বিগত বৰ্ষত অনাস্থা প্ৰস্তাৱৰ সন্মুখীন হৈ প্ৰধানমন্ত্ৰী পদৰ পৰা ক্ষমতাচ্যুত হবলগা হৈছিল ইমৰান খানআনহাতে খানে তেওঁৰ বিৰুদ্ধে এয়া ষড়যন্ত্ৰ বুলি অভিহিত কৰি দেশৰ সেনাবাহিনী এই ষড়যন্ত্ৰত জড়িত বুলি অভিযোগ কৰিছিলঅৱশ্যে খানে উত্থাপন কৰা অভিযোগ অস্বীকাৰ কৰি সেনাই এই বিষয়ত কোনো ভূমিকা লোৱা নাই বুলি স্পষ্ট কৰি দিছিল নৰ্থইষ্ট নাও এটা মাল্টিএপ ভিত্তিক সম্পূৰ্ণভাৱে আঞ্চলিক দ্বিভাষিক নিউজ প্টেলপেচাদাৰী ব্যক্তিৰ এটা গোটৰ নেতৃত্বত এই ডিজিটেল অসমীয়া বাতৰি প্ৰতিষ্ঠানটোৱে উত্তৰপূবৰ আঠখন ৰাজ্য আৰু এইবোৰৰ প্ৰতিৱেশী দেশকেইখনৰ প্ৰতিটো খাখবৰ সামৰি লোৱাৰ চেষ্টা কৰিবদুটাকৈ ইংৰাজী এপ আৰু এটা অসমীয়া এপৰ সংস্কৰণ থকা এইটোৱে হল এই ধৰণৰ প্ৰথমটো নিউজ প্টেলআমি ৰাজনৈতিকভাৱে নিৰপেক্ষ আৰু দক্ষিণপূব আৰু দক্ষিণ এছিয়াৰ মাজৰ প্ৰকৃত বাবাতৰিৰ সাঁকোৰ ভূমিকা লবলৈ চেষ্টা কৰিম,ইমৰান খানক দুৰ্নীতি আৰু অৰ্থ লোণ আইনৰ অধীনত গ্ৰেপ্তাৰ কৰা হৈছে। এই সিদ্ধান্তত তেওঁৰ রাজনৈতিক কেৰিয়াৰ আৰু সুনাম বহুলাংকৰ ক্ষতি হৈছে।
